root@lamp-ubuntu-s-1vcpu-1gb-tor1-01:~# tcpdump -n -i eth0
17:05:33.116195 IP 159.89.118.31.22 > 184.145.62.250.50756: Flags [P.], seq 1550636:1551008, ack 901, win 501, length 372
17:05:33.116253 IP 184.145.62.250.50756 > 159.89.118.31.22: Flags [.], ack 1549712, win 1024, length 0
17:05:33.116363 IP 184.145.62.250.50756 > 159.89.118.31.22: Flags [.], ack 1550040, win 1023, length 0
17:05:33.116580 IP 159.89.118.31.22 > 184.145.62.250.50756: Flags [P.], seq 1551008:1551380, ack 901, win 501, length 372
17:05:33.116774 IP 159.89.118.31.22 > 184.145.62.250.50756: Flags [P.], seq 1551380:1551544, ack 901, win 501, length 164
17:05:33.117077 IP 159.89.118.31.22 > 184.145.62.250.50756: Flags [P.], seq 1551544:1551708, ack 901, win 501, length 164
17:05:33.117135 IP 184.145.62.250.50756 > 159.89.118.31.22: Flags [.], ack 1550368, win 1022, length 0
17:05:33.117301 IP 159.89.118.31.22 > 184.145.62.250.50756: Flags [P.], seq 1551708:1551976, ack 901, win 501, length 268
17:05:33.117423 IP 159.89.118.31.22 > 184.145.62.250.50756: Flags [P.], seq 1551976:1552140, ack 901, win 501, length 164
17:05:33.117650 IP 159.89.118.31.22 > 184.145.62.250.50756: Flags [P.], seq 1552140:1552304, ack 901, win 501, length 164
17:05:33.117812 IP 184.145.62.250.50756 > 159.89.118.31.22: Flags [.], ack 1551008, win 1026, length 0
17:05:33.117949 IP 159.89.118.31.22 > 184.145.62.250.50756: Flags [P.], seq 1552304:1552468, ack 901, win 501, length 164
17:05:33.118206 IP 159.89.118.31.22 > 184.145.62.250.50756: Flags [P.], seq 1552468:1552736, ack 901, win 501, length 268
17:05:33.118363 IP 184.145.62.250.50756 > 159.89.118.31.22: Flags [.], ack 1551544, win 1024, length 0
17:05:33.118584 IP 159.89.118.31.22 > 184.145.62.250.50756: Flags [P.], seq 1552736:1553004, ack 901, win 501, length 268
17:05:33.118756 IP 184.145.62.250.50756 > 159.89.118.31.22: Flags [.], ack 1551976, win 1022, length 0
17:05:33.118859 IP 159.89.118.31.22 > 184.145.62.250.50756: Flags [P.], seq 1553004:1553168, ack 901, win 501, length 164
17:05:33.119050 IP 159.89.118.31.22 > 184.145.62.250.50756: Flags [P.], seq 1553168:1553436, ack 901, win 501, length 268
17:05:33.119225 IP 184.145.62.250.50756 > 159.89.118.31.22: Flags [.], ack 1552304, win 1021, length 0
17:05:33.119226 IP 184.145.62.250.50756 > 159.89.118.31.22: Flags [P.], seq 901:937, ack 1552304, win 1021, length 36
17:05:33.119470 IP 159.89.118.31.22 > 184.145.62.250.50756: Flags [P.], seq 1553436:1553816, ack 937, win 501, length 380
17:05:33.119534 IP 184.145.62.250.50756 > 159.89.118.31.22: Flags [.], ack 1552468, win 1026, length 0
17:05:33.119680 IP 159.89.118.31.22 > 184.145.62.250.50756: Flags [P.], seq 1553816:1554084, ack 937, win 501, length 268
17:05:33.119719 IP 184.145.62.250.50756 > 159.89.118.31.22: Flags [.], ack 1552736, win 1025, length 0
17:05:33.119914 IP 159.89.118.31.22 > 184.145.62.250.50756: Flags [P.], seq 1554084:1554352, ack 937, win 501, length 268
17:05:33.120129 IP 159.89.118.31.22 > 184.145.62.250.50756: Flags [P.], seq 1554352:1554516, ack 937, win 501, length 164
17:05:33.120339 IP 159.89.118.31.22 > 184.145.62.250.50756: Flags [P.], seq 1554516:1554680, ack 937, win 501, length 164
17:05:33.120530 IP 159.89.118.31.22 > 184.145.62.250.50756: Flags [P.], seq 1554680:1554844, ack 937, win 501, length 164
17:05:33.120618 IP 184.145.62.250.50756 > 159.89.118.31.22: Flags [.], ack 1553168, win 1023, length 0
17:05:33.120746 IP 159.89.118.31.22 > 184.145.62.250.50756: Flags [P.], seq 1554844:1555112, ack 937, win 501, length 268
17:05:33.120950 IP 159.89.118.31.22 > 184.145.62.250.50756: Flags [P.], seq 1555112:1555276, ack 937, win 501, length 164
17:05:33.121119 IP 184.145.62.250.50756 > 159.89.118.31.22: Flags [.], ack 1553816, win 1021, length 0
17:05:33.121178 IP 159.89.118.31.22 > 184.145.62.250.50756: Flags [P.], seq 1555276:1555440, ack 937, win 501, length 164
17:05:33.121322 IP 159.89.118.31.22 > 184.145.62.250.50756: Flags [P.], seq 1555440:1555708, ack 937, win 501, length 268
17:05:33.121364 IP 184.145.62.250.50756 > 159.89.118.31.22: Flags [.], ack 1554352, win 1026, length 0
17:05:33.121483 IP 159.89.118.31.22 > 184.145.62.250.50756: Flags [P.], seq 1555708:1555976, ack 937, win 501, length 268
17:05:33.121597 IP 159.89.118.31.22 > 184.145.62.250.50756: Flags [P.], seq 1555976:1556140, ack 937, win 501, length 164
17:05:33.121712 IP 159.89.118.31.22 > 184.145.62.250.50756: Flags [P.], seq 1556140:1556304, ack 937, win 501, length 164
17:05:33.121825 IP 159.89.118.31.22 > 184.145.62.250.50756: Flags [P.], seq 1556304:1556468, ack 937, win 501, length 164
17:05:33.122000 IP 159.89.118.31.22 > 184.145.62.250.50756: Flags [P.], seq 1556468:1556632, ack 937, win 501, length 164
17:05:33.122059 IP 184.145.62.250.50756 > 159.89.118.31.22: Flags [.], ack 1554680, win 1025, length 0
17:05:33.122216 IP 159.89.118.31.22 > 184.145.62.250.50756: Flags [P.], seq 1556632:1556900, ack 937, win 501, length 268
17:05:33.122417 IP 159.89.118.31.22 > 184.145.62.250.50756: Flags [P.], seq 1556900:1557064, ack 937, win 501, length 164
17:05:33.122493 IP 184.145.62.250.50756 > 159.89.118.31.22: Flags [.], ack 1555112, win 1023, length 0
17:05:33.122641 IP 159.89.118.31.22 > 184.145.62.250.50756: Flags [P.], seq 1557064:1557332, ack 937, win 501, length 268
17:05:33.122769 IP 159.89.118.31.22 > 184.145.62.250.50756: Flags [P.], seq 1557332:1557496, ack 937, win 501, length 164
17:05:33.122879 IP 159.89.118.31.22 > 184.145.62.250.50756: Flags [P.], seq 1557496:1557660, ack 937, win 501, length 164
17:05:33.122971 IP 184.145.62.250.50756 > 159.89.118.31.22: Flags [.], ack 1555440, win 1022, length 0
17:05:33.123039 IP 159.89.118.31.22 > 184.145.62.250.50756: Flags [P.], seq 1557660:1557824, ack 937, win 501, length 164
17:05:33.123113 IP 184.145.62.250.50756 > 159.89.118.31.22: Flags [.], ack 1555976, win 1026, length 0
17:05:33.123253 IP 184.145.62.250.50756 > 159.89.118.31.22: Flags [.], ack 1556304, win 1025, length 0
17:05:33.123455 IP 159.89.118.31.22 > 184.145.62.250.50756: Flags [P.], seq 1557824:1558300, ack 937, win 501, length 476
17:05:33.123488 IP 184.145.62.250.50756 > 159.89.118.31.22: Flags [.], ack 1556632, win 1024, length 0
17:05:33.123622 IP 159.89.118.31.22 > 184.145.62.250.50756: Flags [P.], seq 1558300:1558568, ack 937, win 501, length 268
17:05:33.123804 IP 159.89.118.31.22 > 184.145.62.250.50756: Flags [P.], seq 1558568:1558732, ack 937, win 501, length 164
17:05:33.123950 IP 159.89.118.31.22 > 184.145.62.250.50756: Flags [P.], seq 1558732:1558896, ack 937, win 501, length 164
17:05:33.124112 IP 184.145.62.250.50756 > 159.89.118.31.22: Flags [.], ack 1557064, win 1022, length 0
17:05:33.124139 IP 159.89.118.31.22 > 184.145.62.250.50756: Flags [P.], seq 1558896:1559060, ack 937, win 501, length 164
17:05:33.124369 IP 159.89.118.31.22 > 184.145.62.250.50756: Flags [P.], seq 1559060:1559328, ack 937, win 501, length 268
17:05:33.124492 IP 184.145.62.250.50756 > 159.89.118.31.22: Flags [.], ack 1557496, win 1026, length 0
17:05:33.124492 IP 184.145.62.250.50756 > 159.89.118.31.22: Flags [.], ack 1557824, win 1025, length 0
17:05:33.124550 IP 159.89.118.31.22 > 184.145.62.250.50756: Flags [P.], seq 1559328:1559492, ack 937, win 501, length 164
17:05:33.124708 IP 159.89.118.31.22 > 184.145.62.250.50756: Flags [P.], seq 1559492:1559864, ack 937, win 501, length 372
17:05:33.124826 IP 159.89.118.31.22 > 184.145.62.250.50756: Flags [P.], seq 1559864:1560028, ack 937, win 501, length 164
17:05:33.124936 IP 159.89.118.31.22 > 184.145.62.250.50756: Flags [P.], seq 1560028:1560192, ack 937, win 501, length 164
17:05:33.125047 IP 159.89.118.31.22 > 184.145.62.250.50756: Flags [P.], seq 1560192:1560356, ack 937, win 501, length 164
17:05:33.125127 IP 184.145.62.250.50756 > 159.89.118.31.22: Flags [.], ack 1558568, win 1022, length 0
17:05:33.125222 IP 159.89.118.31.22 > 184.145.62.250.50756: Flags [P.], seq 1560356:1560624, ack 937, win 501, length 268
17:05:33.125355 IP 184.145.62.250.50756 > 159.89.118.31.22: Flags [.], ack 1558896, win 1021, length 0
17:05:33.125368 IP 159.89.118.31.22 > 184.145.62.250.50756: Flags [P.], seq 1560624:1560788, ack 937, win 501, length 164
17:05:33.125501 IP 159.89.118.31.22 > 184.145.62.250.50756: Flags [P.], seq 1560788:1561056, ack 937, win 501, length 268
17:05:33.125634 IP 159.89.118.31.22 > 184.145.62.250.50756: Flags [P.], seq 1561056:1561220, ack 937, win 501, length 164
17:05:33.125860 IP 184.145.62.250.50756 > 159.89.118.31.22: Flags [.], ack 1559328, win 1026, length 0
17:05:33.125994 IP 159.89.118.31.22 > 184.145.62.250.50756: Flags [P.], seq 1561220:1561488, ack 937, win 501, length 268
17:05:33.126117 IP 159.89.118.31.22 > 184.145.62.250.50756: Flags [P.], seq 1561488:1561652, ack 937, win 501, length 164
17:05:33.126226 IP 159.89.118.31.22 > 184.145.62.250.50756: Flags [P.], seq 1561652:1561816, ack 937, win 501, length 164
17:05:33.126370 IP 184.145.62.250.50756 > 159.89.118.31.22: Flags [.], ack 1559864, win 1024, length 0
17:05:33.126477 IP 184.145.62.250.50756 > 159.89.118.31.22: Flags [.], ack 1560192, win 1023, length 0
17:05:33.126592 IP 184.145.62.250.50756 > 159.89.118.31.22: Flags [.], ack 1560624, win 1021, length 0
17:05:33.126636 IP 159.89.118.31.22 > 184.145.62.250.50756: Flags [P.], seq 1561816:1562188, ack 937, win 501, length 372
17:05:33.126775 IP 159.89.118.31.22 > 184.145.62.250.50756: Flags [P.], seq 1562188:1562456, ack 937, win 501, length 268
17:05:33.126891 IP 159.89.118.31.22 > 184.145.62.250.50756: Flags [P.], seq 1562456:1562620, ack 937, win 501, length 164
17:05:33.127024 IP 159.89.118.31.22 > 184.145.62.250.50756: Flags [P.], seq 1562620:1562784, ack 937, win 501, length 164
17:05:33.127102 IP 184.145.62.250.50756 > 159.89.118.31.22: Flags [.], ack 1561056, win 1026, length 0
17:05:33.127190 IP 159.89.118.31.22 > 184.145.62.250.50756: Flags [P.], seq 1562784:1563052, ack 937, win 501, length 268
17:05:33.127376 IP 159.89.118.31.22 > 184.145.62.250.50756: Flags [P.], seq 1563052:1563216, ack 937, win 501, length 164
17:05:33.127535 IP 159.89.118.31.22 > 184.145.62.250.50756: Flags [P.], seq 1563216:1563380, ack 937, win 501, length 164
17:05:33.127744 IP 184.145.62.250.50756 > 159.89.118.31.22: Flags [.], ack 1561488, win 1024, length 0
17:05:33.127860 IP 184.145.62.250.50756 > 159.89.118.31.22: Flags [.], ack 1561816, win 1023, length 0
17:05:33.127915 IP 159.89.118.31.22 > 184.145.62.250.50756: Flags [P.], seq 1563380:1563544, ack 937, win 501, length 164
17:05:33.128011 IP 159.89.118.31.22 > 184.145.62.250.50756: Flags [P.], seq 1563544:1563684, ack 937, win 501, length 140
17:05:33.128178 IP 159.89.118.31.22 > 184.145.62.250.50756: Flags [P.], seq 1563684:1564072, ack 937, win 501, length 388
17:05:33.128243 IP 184.145.62.250.50756 > 159.89.118.31.22: Flags [.], ack 1562456, win 1021, length 0
17:05:33.128434 IP 159.89.118.31.22 > 184.145.62.250.50756: Flags [P.], seq 1564072:1564340, ack 937, win 501, length 268
17:05:33.128642 IP 159.89.118.31.22 > 184.145.62.250.50756: Flags [P.], seq 1564340:1564504, ack 937, win 501, length 164
17:05:33.128723 IP 184.145.62.250.50756 > 159.89.118.31.22: Flags [.], ack 1562784, win 1026, length 0
17:05:33.128864 IP 184.145.62.250.50756 > 159.89.118.31.22: Flags [.], ack 1563216, win 1024, length 0
17:05:33.128947 IP 159.89.118.31.22 > 184.145.62.250.50756: Flags [P.], seq 1564504:1564772, ack 937, win 501, length 268
17:05:33.129113 IP 159.89.118.31.22 > 184.145.62.250.50756: Flags [P.], seq 1564772:1565040, ack 937, win 501, length 268
17:05:33.129373 IP 159.89.118.31.22 > 184.145.62.250.50756: Flags [P.], seq 1565040:1565204, ack 937, win 501, length 164
17:05:33.129479 IP 184.145.62.250.50756 > 159.89.118.31.22: Flags [.], ack 1563684, win 1023, length 0
17:05:33.129603 IP 184.145.62.250.50756 > 159.89.118.31.22: Flags [.], ack 1564072, win 1021, length 0
17:05:33.129746 IP 159.89.118.31.22 > 184.145.62.250.50756: Flags [P.], seq 1565204:1565576, ack 937, win 501, length 372
17:05:33.129947 IP 159.89.118.31.22 > 184.145.62.250.50756: Flags [P.], seq 1565576:1565740, ack 937, win 501, length 164
17:05:33.130125 IP 184.145.62.250.50756 > 159.89.118.31.22: Flags [.], ack 1564504, win 1026, length 0
17:05:33.130254 IP 159.89.118.31.22 > 184.145.62.250.50756: Flags [P.], seq 1565740:1566008, ack 937, win 501, length 268
17:05:33.130386 IP 159.89.118.31.22 > 184.145.62.250.50756: Flags [P.], seq 1566008:1566172, ack 937, win 501, length 164
17:05:33.130529 IP 159.89.118.31.22 > 184.145.62.250.50756: Flags [P.], seq 1566172:1566336, ack 937, win 501, length 164
17:05:33.130600 IP 184.145.62.250.50756 > 159.89.118.31.22: Flags [.], ack 1565040, win 1024, length 0
17:05:33.130700 IP 159.89.118.31.22 > 184.145.62.250.50756: Flags [P.], seq 1566336:1566604, ack 937, win 501, length 268
17:05:33.130886 IP 159.89.118.31.22 > 184.145.62.250.50756: Flags [P.], seq 1566604:1566768, ack 937, win 501, length 164
17:05:33.131051 IP 159.89.118.31.22 > 184.145.62.250.50756: Flags [P.], seq 1566768:1566932, ack 937, win 501, length 164
17:05:33.131243 IP 184.145.62.250.50756 > 159.89.118.31.22: Flags [.], ack 1565576, win 1022, length 0
17:05:33.131260 IP 159.89.118.31.22 > 184.145.62.250.50756: Flags [P.], seq 1566932:1567096, ack 937, win 501, length 164
17:05:33.131427 IP 159.89.118.31.22 > 184.145.62.250.50756: Flags [P.], seq 1567096:1567364, ack 937, win 501, length 268
17:05:33.131610 IP 159.89.118.31.22 > 184.145.62.250.50756: Flags [P.], seq 1567364:1567528, ack 937, win 501, length 164
17:05:33.131730 IP 184.145.62.250.50756 > 159.89.118.31.22: Flags [.], ack 1566008, win 1026, length 0
17:05:33.131794 IP 159.89.118.31.22 > 184.145.62.250.50756: Flags [P.], seq 1567528:1567692, ack 937, win 501, length 164
17:05:33.132015 IP 159.89.118.31.22 > 184.145.62.250.50756: Flags [P.], seq 1567692:1567960, ack 937, win 501, length 268
17:05:33.132138 IP 184.145.62.250.50756 > 159.89.118.31.22: Flags [.], ack 1566336, win 1025, length 0
17:05:33.132332 IP 159.89.118.31.22 > 184.145.62.250.50756: Flags [P.], seq 1567960:1568228, ack 937, win 501, length 268
17:05:33.132544 IP 159.89.118.31.22 > 184.145.62.250.50756: Flags [P.], seq 1568228:1568392, ack 937, win 501, length 164
17:05:33.132646 IP 184.145.62.250.50756 > 159.89.118.31.22: Flags [.], ack 1566932, win 1023, length 0
17:05:33.132835 IP 159.89.118.31.22 > 184.145.62.250.50756: Flags [P.], seq 1568392:1568660, ack 937, win 501, length 268
17:05:33.132891 IP 184.145.62.250.50756 > 159.89.118.31.22: Flags [.], ack 1567096, win 1022, length 0
17:05:33.133104 IP 184.145.62.250.50756 > 159.89.118.31.22: Flags [.], ack 1567528, win 1026, length 0
17:05:33.133126 IP 159.89.118.31.22 > 184.145.62.250.50756: Flags [P.], seq 1568660:1568928, ack 937, win 501, length 268
17:05:33.133331 IP 159.89.118.31.22 > 184.145.62.250.50756: Flags [P.], seq 1568928:1569196, ack 937, win 501, length 268
17:05:33.133506 IP 159.89.118.31.22 > 184.145.62.250.50756: Flags [P.], seq 1569196:1569360, ack 937, win 501, length 164
17:05:33.133673 IP 159.89.118.31.22 > 184.145.62.250.50756: Flags [P.], seq 1569360:1569524, ack 937, win 501, length 164
17:05:33.133736 IP 184.145.62.250.50756 > 159.89.118.31.22: Flags [.], ack 1567960, win 1024, length 0
17:05:33.133844 IP 159.89.118.31.22 > 184.145.62.250.50756: Flags [P.], seq 1569524:1569792, ack 937, win 501, length 268
17:05:33.133964 IP 159.89.118.31.22 > 184.145.62.250.50756: Flags [P.], seq 1569792:1569956, ack 937, win 501, length 164
17:05:33.134073 IP 159.89.118.31.22 > 184.145.62.250.50756: Flags [P.], seq 1569956:1570120, ack 937, win 501, length 164
17:05:33.134202 IP 159.89.118.31.22 > 184.145.62.250.50756: Flags [P.], seq 1570120:1570284, ack 937, win 501, length 164
17:05:33.134227 IP 184.145.62.250.50756 > 159.89.118.31.22: Flags [.], ack 1568392, win 1023, length 0
17:05:33.134477 IP 159.89.118.31.22 > 184.145.62.250.50756: Flags [P.], seq 1570284:1570552, ack 937, win 501, length 268
17:05:33.134782 IP 184.145.62.250.50756 > 159.89.118.31.22: Flags [.], ack 1568928, win 1021, length 0
17:05:33.134831 IP 159.89.118.31.22 > 184.145.62.250.50756: Flags [P.], seq 1570552:1570716, ack 937, win 501, length 164
17:05:33.134987 IP 184.145.62.250.50756 > 159.89.118.31.22: Flags [.], ack 1569360, win 1026, length 0
17:05:33.135124 IP 159.89.118.31.22 > 184.145.62.250.50756: Flags [P.], seq 1570716:1571088, ack 937, win 501, length 372
17:05:33.135310 IP 159.89.118.31.22 > 184.145.62.250.50756: Flags [P.], seq 1571088:1571252, ack 937, win 501, length 164
17:05:33.135398 IP 184.145.62.250.50756 > 159.89.118.31.22: Flags [.], ack 1569792, win 1024, length 0
17:05:33.135612 IP 159.89.118.31.22 > 184.145.62.250.50756: Flags [P.], seq 1571252:1571520, ack 937, win 501, length 268
17:05:33.135735 IP 184.145.62.250.50756 > 159.89.118.31.22: Flags [.], ack 1570120, win 1023, length 0
17:05:33.135915 IP 159.89.118.31.22 > 184.145.62.250.50756: Flags [P.], seq 1571520:1571788, ack 937, win 501, length 268
17:05:33.136057 IP 159.89.118.31.22 > 184.145.62.250.50756: Flags [P.], seq 1571788:1571952, ack 937, win 501, length 164
17:05:33.136209 IP 159.89.118.31.22 > 184.145.62.250.50756: Flags [P.], seq 1571952:1572116, ack 937, win 501, length 164
17:05:33.136426 IP 159.89.118.31.22 > 184.145.62.250.50756: Flags [P.], seq 1572116:1572280, ack 937, win 501, length 164
17:05:33.136512 IP 184.145.62.250.50756 > 159.89.118.31.22: Flags [.], ack 1570552, win 1021, length 0
17:05:33.136691 IP 159.89.118.31.22 > 184.145.62.250.50756: Flags [P.], seq 1572280:1572548, ack 937, win 501, length 268
17:05:33.136738 IP 184.145.62.250.50756 > 159.89.118.31.22: Flags [.], ack 1571088, win 1026, length 0
17:05:33.136873 IP 159.89.118.31.22 > 184.145.62.250.50756: Flags [P.], seq 1572548:1572816, ack 937, win 501, length 268
17:05:33.137052 IP 159.89.118.31.22 > 184.145.62.250.50756: Flags [P.], seq 1572816:1572980, ack 937, win 501, length 164
17:05:33.137146 IP 184.145.62.250.50756 > 159.89.118.31.22: Flags [.], ack 1571520, win 1024, length 0
17:05:33.137343 IP 159.89.118.31.22 > 184.145.62.250.50756: Flags [P.], seq 1572980:1573248, ack 937, win 501, length 268
17:05:33.137564 IP 159.89.118.31.22 > 184.145.62.250.50756: Flags [P.], seq 1573248:1573412, ack 937, win 501, length 164
17:05:33.137742 IP 184.145.62.250.50756 > 159.89.118.31.22: Flags [.], ack 1571952, win 1023, length 0
17:05:33.137837 IP 159.89.118.31.22 > 184.145.62.250.50756: Flags [P.], seq 1573412:1573576, ack 937, win 501, length 164
17:05:33.138076 IP 159.89.118.31.22 > 184.145.62.250.50756: Flags [P.], seq 1573576:1573844, ack 937, win 501, length 268
17:05:33.138240 IP 184.145.62.250.50756 > 159.89.118.31.22: Flags [.], ack 1572280, win 1021, length 0
17:05:33.138347 IP 184.145.62.250.50756 > 159.89.118.31.22: Flags [.], ack 1572816, win 1026, length 0
17:05:33.138552 IP 159.89.118.31.22 > 184.145.62.250.50756: Flags [P.], seq 1573844:1574216, ack 937, win 501, length 372
17:05:33.138747 IP 159.89.118.31.22 > 184.145.62.250.50756: Flags [P.], seq 1574216:1574380, ack 937, win 501, length 164
17:05:33.138880 IP 184.145.62.250.50756 > 159.89.118.31.22: Flags [.], ack 1573248, win 1024, length 0
17:05:33.138920 IP 159.89.118.31.22 > 184.145.62.250.50756: Flags [P.], seq 1574380:1574544, ack 937, win 501, length 164
17:05:33.139111 IP 159.89.118.31.22 > 184.145.62.250.50756: Flags [P.], seq 1574544:1574812, ack 937, win 501, length 268
17:05:33.139340 IP 159.89.118.31.22 > 184.145.62.250.50756: Flags [P.], seq 1574812:1574976, ack 937, win 501, length 164
17:05:33.139562 IP 159.89.118.31.22 > 184.145.62.250.50756: Flags [P.], seq 1574976:1575140, ack 937, win 501, length 164
17:05:33.139613 IP 184.145.62.250.50756 > 159.89.118.31.22: Flags [.], ack 1573576, win 1023, length 0
17:05:33.139825 IP 159.89.118.31.22 > 184.145.62.250.50756: Flags [P.], seq 1575140:1575408, ack 937, win 501, length 268
17:05:33.139975 IP 159.89.118.31.22 > 184.145.62.250.50756: Flags [P.], seq 1575408:1575572, ack 937, win 501, length 164
17:05:33.140127 IP 184.145.62.250.50756 > 159.89.118.31.22: Flags [.], ack 1574216, win 1021, length 0
17:05:33.140331 IP 159.89.118.31.22 > 184.145.62.250.50756: Flags [P.], seq 1575572:1575840, ack 937, win 501, length 268
17:05:33.140388 IP 184.145.62.250.50756 > 159.89.118.31.22: Flags [.], ack 1574544, win 1026, length 0
17:05:33.140603 IP 159.89.118.31.22 > 184.145.62.250.50756: Flags [P.], seq 1575840:1576108, ack 937, win 501, length 268
17:05:33.140805 IP 159.89.118.31.22 > 184.145.62.250.50756: Flags [P.], seq 1576108:1576272, ack 937, win 501, length 164
17:05:33.140935 IP 184.145.62.250.50756 > 159.89.118.31.22: Flags [.], ack 1574976, win 1024, length 0
17:05:33.141106 IP 159.89.118.31.22 > 184.145.62.250.50756: Flags [P.], seq 1576272:1576540, ack 937, win 501, length 268
17:05:33.141308 IP 159.89.118.31.22 > 184.145.62.250.50756: Flags [P.], seq 1576540:1576704, ack 937, win 501, length 164
17:05:33.141487 IP 184.145.62.250.50756 > 159.89.118.31.22: Flags [.], ack 1575408, win 1023, length 0
17:05:33.141571 IP 159.89.118.31.22 > 184.145.62.250.50756: Flags [P.], seq 1576704:1576868, ack 937, win 501, length 164
17:05:33.141738 IP 159.89.118.31.22 > 184.145.62.250.50756: Flags [P.], seq 1576868:1577136, ack 937, win 501, length 268
17:05:33.141859 IP 159.89.118.31.22 > 184.145.62.250.50756: Flags [P.], seq 1577136:1577300, ack 937, win 501, length 164
17:05:33.141975 IP 184.145.62.250.50756 > 159.89.118.31.22: Flags [.], ack 1575840, win 1021, length 0
17:05:33.142041 IP 159.89.118.31.22 > 184.145.62.250.50756: Flags [P.], seq 1577300:1577464, ack 937, win 501, length 164
17:05:33.142151 IP 159.89.118.31.22 > 184.145.62.250.50756: Flags [P.], seq 1577464:1577732, ack 937, win 501, length 268
17:05:33.142224 IP 184.145.62.250.50756 > 159.89.118.31.22: Flags [.], ack 1576272, win 1026, length 0
17:05:33.142309 IP 159.89.118.31.22 > 184.145.62.250.50756: Flags [P.], seq 1577732:1578000, ack 937, win 501, length 268
17:05:33.142428 IP 159.89.118.31.22 > 184.145.62.250.50756: Flags [P.], seq 1578000:1578164, ack 937, win 501, length 164
17:05:33.142628 IP 159.89.118.31.22 > 184.145.62.250.50756: Flags [P.], seq 1578164:1578328, ack 937, win 501, length 164
17:05:33.142836 IP 159.89.118.31.22 > 184.145.62.250.50756: Flags [P.], seq 1578328:1578492, ack 937, win 501, length 164
17:05:33.142884 IP 184.145.62.250.50756 > 159.89.118.31.22: Flags [.], ack 1576704, win 1024, length 0
17:05:33.143097 IP 159.89.118.31.22 > 184.145.62.250.50756: Flags [P.], seq 1578492:1578760, ack 937, win 501, length 268
17:05:33.143253 IP 184.145.62.250.50756 > 159.89.118.31.22: Flags [.], ack 1577136, win 1023, length 0
17:05:33.143325 IP 159.89.118.31.22 > 184.145.62.250.50756: Flags [P.], seq 1578760:1578924, ack 937, win 501, length 164
17:05:33.143483 IP 184.145.62.250.50756 > 159.89.118.31.22: Flags [.], ack 1577464, win 1021, length 0
17:05:33.143651 IP 159.89.118.31.22 > 184.145.62.250.50756: Flags [P.], seq 1578924:1579296, ack 937, win 501, length 372
17:05:33.143838 IP 159.89.118.31.22 > 184.145.62.250.50756: Flags [P.], seq 1579296:1579460, ack 937, win 501, length 164
17:05:33.144010 IP 159.89.118.31.22 > 184.145.62.250.50756: Flags [P.], seq 1579460:1579624, ack 937, win 501, length 164
17:05:33.144094 IP 184.145.62.250.50756 > 159.89.118.31.22: Flags [.], ack 1578164, win 1026, length 0
17:05:33.144200 IP 159.89.118.31.22 > 184.145.62.250.50756: Flags [P.], seq 1579624:1579892, ack 937, win 501, length 268
17:05:33.144256 IP 184.145.62.250.50756 > 159.89.118.31.22: Flags [.], ack 1578328, win 1025, length 0
17:05:33.144472 IP 159.89.118.31.22 > 184.145.62.250.50756: Flags [P.], seq 1579892:1580160, ack 937, win 501, length 268
17:05:33.144612 IP 184.145.62.250.50756 > 159.89.118.31.22: Flags [.], ack 1578760, win 1024, length 0
17:05:33.144774 IP 159.89.118.31.22 > 184.145.62.250.50756: Flags [P.], seq 1580160:1580428, ack 937, win 501, length 268
17:05:33.144993 IP 159.89.118.31.22 > 184.145.62.250.50756: Flags [P.], seq 1580428:1580592, ack 937, win 501, length 164
17:05:33.145093 IP 184.145.62.250.50756 > 159.89.118.31.22: Flags [.], ack 1579296, win 1022, length 0
17:05:33.145300 IP 159.89.118.31.22 > 184.145.62.250.50756: Flags [P.], seq 1580592:1580860, ack 937, win 501, length 268
17:05:33.145479 IP 159.89.118.31.22 > 184.145.62.250.50756: Flags [P.], seq 1580860:1581024, ack 937, win 501, length 164
17:05:33.145733 IP 184.145.62.250.50756 > 159.89.118.31.22: Flags [.], ack 1579624, win 1026, length 0
17:05:33.145793 IP 159.89.118.31.22 > 184.145.62.250.50756: Flags [P.], seq 1581024:1581188, ack 937, win 501, length 164
17:05:33.146036 IP 159.89.118.31.22 > 184.145.62.250.50756: Flags [P.], seq 1581188:1581456, ack 937, win 501, length 268
17:05:33.146177 IP 159.89.118.31.22 > 184.145.62.250.50756: Flags [P.], seq 1581456:1581620, ack 937, win 501, length 164
17:05:33.146280 IP 184.145.62.250.50756 > 159.89.118.31.22: Flags [.], ack 1580160, win 1024, length 0
17:05:33.146470 IP 159.89.118.31.22 > 184.145.62.250.50756: Flags [P.], seq 1581620:1581888, ack 937, win 501, length 268
17:05:33.146570 IP 184.145.62.250.50756 > 159.89.118.31.22: Flags [.], ack 1580592, win 1022, length 0
17:05:33.146792 IP 159.89.118.31.22 > 184.145.62.250.50756: Flags [P.], seq 1581888:1582156, ack 937, win 501, length 268
17:05:33.146956 IP 159.89.118.31.22 > 184.145.62.250.50756: Flags [P.], seq 1582156:1582320, ack 937, win 501, length 164
17:05:33.147011 IP 184.145.62.250.50756 > 159.89.118.31.22: Flags [.], ack 1581024, win 1021, length 0
17:05:33.147169 IP 159.89.118.31.22 > 184.145.62.250.50756: Flags [P.], seq 1582320:1582588, ack 937, win 501, length 268
17:05:33.147311 IP 159.89.118.31.22 > 184.145.62.250.50756: Flags [P.], seq 1582588:1582752, ack 937, win 501, length 164
17:05:33.147422 IP 159.89.118.31.22 > 184.145.62.250.50756: Flags [P.], seq 1582752:1582916, ack 937, win 501, length 164
17:05:33.147497 IP 184.145.62.250.50756 > 159.89.118.31.22: Flags [.], ack 1581456, win 1026, length 0
17:05:33.147589 IP 159.89.118.31.22 > 184.145.62.250.50756: Flags [P.], seq 1582916:1583184, ack 937, win 501, length 268
17:05:33.147705 IP 159.89.118.31.22 > 184.145.62.250.50756: Flags [P.], seq 1583184:1583348, ack 937, win 501, length 164
17:05:33.147826 IP 159.89.118.31.22 > 184.145.62.250.50756: Flags [P.], seq 1583348:1583512, ack 937, win 501, length 164
17:05:33.147989 IP 184.145.62.250.50756 > 159.89.118.31.22: Flags [.], ack 1581888, win 1024, length 0
17:05:33.148088 IP 159.89.118.31.22 > 184.145.62.250.50756: Flags [P.], seq 1583512:1583676, ack 937, win 501, length 164
17:05:33.148226 IP 159.89.118.31.22 > 184.145.62.250.50756: Flags [P.], seq 1583676:1583944, ack 937, win 501, length 268
17:05:33.148394 IP 159.89.118.31.22 > 184.145.62.250.50756: Flags [P.], seq 1583944:1584108, ack 937, win 501, length 164
17:05:33.148499 IP 184.145.62.250.50756 > 159.89.118.31.22: Flags [.], ack 1582320, win 1023, length 0
17:05:33.148626 IP 159.89.118.31.22 > 184.145.62.250.50756: Flags [P.], seq 1584108:1584376, ack 937, win 501, length 268
17:05:33.148780 IP 159.89.118.31.22 > 184.145.62.250.50756: Flags [P.], seq 1584376:1584540, ack 937, win 501, length 164
17:05:33.148861 IP 184.145.62.250.50756 > 159.89.118.31.22: Flags [.], ack 1582752, win 1021, length 0
17:05:33.148979 IP 184.145.62.250.50756 > 159.89.118.31.22: Flags [.], ack 1583184, win 1026, length 0
17:05:33.149112 IP 159.89.118.31.22 > 184.145.62.250.50756: Flags [P.], seq 1584540:1584912, ack 937, win 501, length 372
17:05:33.149276 IP 159.89.118.31.22 > 184.145.62.250.50756: Flags [P.], seq 1584912:1585076, ack 937, win 501, length 164
17:05:33.149357 IP 184.145.62.250.50756 > 159.89.118.31.22: Flags [.], ack 1583512, win 1025, length 0
17:05:33.149476 IP 159.89.118.31.22 > 184.145.62.250.50756: Flags [P.], seq 1585076:1585344, ack 937, win 501, length 268
17:05:33.149628 IP 159.89.118.31.22 > 184.145.62.250.50756: Flags [P.], seq 1585344:1585508, ack 937, win 501, length 164
17:05:33.149735 IP 184.145.62.250.50756 > 159.89.118.31.22: Flags [.], ack 1583944, win 1023, length 0
17:05:33.149838 IP 159.89.118.31.22 > 184.145.62.250.50756: Flags [P.], seq 1585508:1585776, ack 937, win 501, length 268
17:05:33.149987 IP 159.89.118.31.22 > 184.145.62.250.50756: Flags [P.], seq 1585776:1585940, ack 937, win 501, length 164
17:05:33.150131 IP 159.89.118.31.22 > 184.145.62.250.50756: Flags [P.], seq 1585940:1586104, ack 937, win 501, length 164
17:05:33.150264 IP 184.145.62.250.50756 > 159.89.118.31.22: Flags [.], ack 1584376, win 1021, length 0
17:05:33.150389 IP 159.89.118.31.22 > 184.145.62.250.50756: Flags [P.], seq 1586104:1586372, ack 937, win 501, length 268
17:05:33.150593 IP 159.89.118.31.22 > 184.145.62.250.50756: Flags [P.], seq 1586372:1586536, ack 937, win 501, length 164
17:05:33.150765 IP 159.89.118.31.22 > 184.145.62.250.50756: Flags [P.], seq 1586536:1586700, ack 937, win 501, length 164
17:05:33.150900 IP 184.145.62.250.50756 > 159.89.118.31.22: Flags [.], ack 1584912, win 1026, length 0
17:05:33.151039 IP 159.89.118.31.22 > 184.145.62.250.50756: Flags [P.], seq 1586700:1586968, ack 937, win 501, length 268
17:05:33.151184 IP 159.89.118.31.22 > 184.145.62.250.50756: Flags [P.], seq 1586968:1587132, ack 937, win 501, length 164
17:05:33.151282 IP 184.145.62.250.50756 > 159.89.118.31.22: Flags [.], ack 1585344, win 1024, length 0
17:05:33.151370 IP 184.145.62.250.50756 > 159.89.118.31.22: Flags [.], ack 1585776, win 1023, length 0
17:05:33.151468 IP 159.89.118.31.22 > 184.145.62.250.50756: Flags [P.], seq 1587132:1587400, ack 937, win 501, length 268
17:05:33.151860 IP 184.145.62.250.50756 > 159.89.118.31.22: Flags [.], ack 1586104, win 1021, length 0
17:05:33.151892 IP 159.89.118.31.22 > 184.145.62.250.50756: Flags [P.], seq 1587400:1587668, ack 937, win 501, length 268
17:05:33.151979 IP 184.145.62.250.50756 > 159.89.118.31.22: Flags [.], ack 1586536, win 1026, length 0
17:05:33.152114 IP 159.89.118.31.22 > 184.145.62.250.50756: Flags [P.], seq 1587668:1588040, ack 937, win 501, length 372
17:05:33.152253 IP 159.89.118.31.22 > 184.145.62.250.50756: Flags [P.], seq 1588040:1588204, ack 937, win 501, length 164
17:05:33.152441 IP 159.89.118.31.22 > 184.145.62.250.50756: Flags [P.], seq 1588204:1588368, ack 937, win 501, length 164
17:05:33.152610 IP 184.145.62.250.50756 > 159.89.118.31.22: Flags [.], ack 1586968, win 1024, length 0
17:05:33.152678 IP 159.89.118.31.22 > 184.145.62.250.50756: Flags [P.], seq 1588368:1588532, ack 937, win 501, length 164
17:05:33.152876 IP 159.89.118.31.22 > 184.145.62.250.50756: Flags [P.], seq 1588532:1588800, ack 937, win 501, length 268
17:05:33.153055 IP 159.89.118.31.22 > 184.145.62.250.50756: Flags [P.], seq 1588800:1588964, ack 937, win 501, length 164
17:05:33.153231 IP 184.145.62.250.50756 > 159.89.118.31.22: Flags [.], ack 1587400, win 1023, length 0
17:05:33.153328 IP 159.89.118.31.22 > 184.145.62.250.50756: Flags [P.], seq 1588964:1589128, ack 937, win 501, length 164
17:05:33.153444 IP 159.89.118.31.22 > 184.145.62.250.50756: Flags [P.], seq 1589128:1589268, ack 937, win 501, length 140
17:05:33.153609 IP 184.145.62.250.50756 > 159.89.118.31.22: Flags [.], ack 1588040, win 1026, length 0
17:05:33.153699 IP 159.89.118.31.22 > 184.145.62.250.50756: Flags [P.], seq 1589268:1589552, ack 937, win 501, length 284
17:05:33.153808 IP 159.89.118.31.22 > 184.145.62.250.50756: Flags [P.], seq 1589552:1589692, ack 937, win 501, length 140
17:05:33.153887 IP 184.145.62.250.50756 > 159.89.118.31.22: Flags [.], ack 1588368, win 1025, length 0
17:05:33.154023 IP 159.89.118.31.22 > 184.145.62.250.50756: Flags [P.], seq 1589692:1589856, ack 937, win 501, length 164
17:05:33.154120 IP 159.89.118.31.22 > 184.145.62.250.50756: Flags [P.], seq 1589856:1590124, ack 937, win 501, length 268
17:05:33.154302 IP 159.89.118.31.22 > 184.145.62.250.50756: Flags [P.], seq 1590124:1590408, ack 937, win 501, length 284
17:05:33.154394 IP 184.145.62.250.50756 > 159.89.118.31.22: Flags [.], ack 1588800, win 1023, length 0
17:05:33.154573 IP 159.89.118.31.22 > 184.145.62.250.50756: Flags [P.], seq 1590408:1590676, ack 937, win 501, length 268
17:05:33.154749 IP 159.89.118.31.22 > 184.145.62.250.50756: Flags [P.], seq 1590676:1590840, ack 937, win 501, length 164
17:05:33.154911 IP 159.89.118.31.22 > 184.145.62.250.50756: Flags [P.], seq 1590840:1591004, ack 937, win 501, length 164
17:05:33.155007 IP 184.145.62.250.50756 > 159.89.118.31.22: Flags [.], ack 1589128, win 1022, length 0
17:05:33.155107 IP 184.145.62.250.50756 > 159.89.118.31.22: Flags [.], ack 1589552, win 1026, length 0
17:05:33.155197 IP 159.89.118.31.22 > 184.145.62.250.50756: Flags [P.], seq 1591004:1591272, ack 937, win 501, length 268
17:05:33.155552 IP 184.145.62.250.50756 > 159.89.118.31.22: Flags [.], ack 1589856, win 1025, length 0
17:05:33.155580 IP 159.89.118.31.22 > 184.145.62.250.50756: Flags [P.], seq 1591272:1591540, ack 937, win 501, length 268
17:05:33.155792 IP 159.89.118.31.22 > 184.145.62.250.50756: Flags [P.], seq 1591540:1591808, ack 937, win 501, length 268
17:05:33.155988 IP 184.145.62.250.50756 > 159.89.118.31.22: Flags [.], ack 1590408, win 1023, length 0
17:05:33.156015 IP 159.89.118.31.22 > 184.145.62.250.50756: Flags [P.], seq 1591808:1591972, ack 937, win 501, length 164
17:05:33.156211 IP 159.89.118.31.22 > 184.145.62.250.50756: Flags [P.], seq 1591972:1592240, ack 937, win 501, length 268
17:05:33.156357 IP 184.145.62.250.50756 > 159.89.118.31.22: Flags [.], ack 1590840, win 1021, length 0
17:05:33.156503 IP 159.89.118.31.22 > 184.145.62.250.50756: Flags [P.], seq 1592240:1592508, ack 937, win 501, length 268
17:05:33.156767 IP 159.89.118.31.22 > 184.145.62.250.50756: Flags [P.], seq 1592508:1592672, ack 937, win 501, length 164
17:05:33.156931 IP 159.89.118.31.22 > 184.145.62.250.50756: Flags [P.], seq 1592672:1592836, ack 937, win 501, length 164
17:05:33.157034 IP 184.145.62.250.50756 > 159.89.118.31.22: Flags [.], ack 1591272, win 1026, length 0
17:05:33.157140 IP 159.89.118.31.22 > 184.145.62.250.50756: Flags [P.], seq 1592836:1593104, ack 937, win 501, length 268
17:05:33.157234 IP 184.145.62.250.50756 > 159.89.118.31.22: Flags [.], ack 1591808, win 1024, length 0
17:05:33.157348 IP 159.89.118.31.22 > 184.145.62.250.50756: Flags [P.], seq 1593104:1593372, ack 937, win 501, length 268
17:05:33.157503 IP 159.89.118.31.22 > 184.145.62.250.50756: Flags [P.], seq 1593372:1593536, ack 937, win 501, length 164
17:05:33.157652 IP 159.89.118.31.22 > 184.145.62.250.50756: Flags [P.], seq 1593536:1593700, ack 937, win 501, length 164
17:05:33.157795 IP 159.89.118.31.22 > 184.145.62.250.50756: Flags [P.], seq 1593700:1593864, ack 937, win 501, length 164
17:05:33.157879 IP 184.145.62.250.50756 > 159.89.118.31.22: Flags [.], ack 1592240, win 1022, length 0
17:05:33.157998 IP 159.89.118.31.22 > 184.145.62.250.50756: Flags [P.], seq 1593864:1594132, ack 937, win 501, length 268
17:05:33.158145 IP 159.89.118.31.22 > 184.145.62.250.50756: Flags [P.], seq 1594132:1594296, ack 937, win 501, length 164
17:05:33.158241 IP 184.145.62.250.50756 > 159.89.118.31.22: Flags [.], ack 1592672, win 1021, length 0
17:05:33.158408 IP 159.89.118.31.22 > 184.145.62.250.50756: Flags [P.], seq 1594296:1594564, ack 937, win 501, length 268
17:05:33.158617 IP 184.145.62.250.50756 > 159.89.118.31.22: Flags [.], ack 1593104, win 1026, length 0
17:05:33.158653 IP 159.89.118.31.22 > 184.145.62.250.50756: Flags [P.], seq 1594564:1594728, ack 937, win 501, length 164
17:05:33.158871 IP 159.89.118.31.22 > 184.145.62.250.50756: Flags [P.], seq 1594728:1594996, ack 937, win 501, length 268
17:05:33.159038 IP 159.89.118.31.22 > 184.145.62.250.50756: Flags [P.], seq 1594996:1595160, ack 937, win 501, length 164
17:05:33.159104 IP 184.145.62.250.50756 > 159.89.118.31.22: Flags [.], ack 1593536, win 1024, length 0
17:05:33.159242 IP 184.145.62.250.50756 > 159.89.118.31.22: Flags [.], ack 1593864, win 1023, length 0
17:05:33.159276 IP 159.89.118.31.22 > 184.145.62.250.50756: Flags [P.], seq 1595160:1595428, ack 937, win 501, length 268
17:05:33.159415 IP 159.89.118.31.22 > 184.145.62.250.50756: Flags [P.], seq 1595428:1595696, ack 937, win 501, length 268
17:05:33.159528 IP 159.89.118.31.22 > 184.145.62.250.50756: Flags [P.], seq 1595696:1595860, ack 937, win 501, length 164
17:05:33.159637 IP 159.89.118.31.22 > 184.145.62.250.50756: Flags [P.], seq 1595860:1596024, ack 937, win 501, length 164
17:05:33.159745 IP 159.89.118.31.22 > 184.145.62.250.50756: Flags [P.], seq 1596024:1596188, ack 937, win 501, length 164
17:05:33.159840 IP 184.145.62.250.50756 > 159.89.118.31.22: Flags [.], ack 1594296, win 1021, length 0
17:05:33.159893 IP 159.89.118.31.22 > 184.145.62.250.50756: Flags [P.], seq 1596188:1596352, ack 937, win 501, length 164
17:05:33.160030 IP 159.89.118.31.22 > 184.145.62.250.50756: Flags [P.], seq 1596352:1596620, ack 937, win 501, length 268
17:05:33.160138 IP 159.89.118.31.22 > 184.145.62.250.50756: Flags [P.], seq 1596620:1596784, ack 937, win 501, length 164
17:05:33.160248 IP 184.145.62.250.50756 > 159.89.118.31.22: Flags [.], ack 1594728, win 1026, length 0
17:05:33.160362 IP 159.89.118.31.22 > 184.145.62.250.50756: Flags [P.], seq 1596784:1597052, ack 937, win 501, length 268
17:05:33.160477 IP 159.89.118.31.22 > 184.145.62.250.50756: Flags [P.], seq 1597052:1597216, ack 937, win 501, length 164
17:05:33.160591 IP 184.145.62.250.50756 > 159.89.118.31.22: Flags [.], ack 1595160, win 1024, length 0
17:05:33.160646 IP 159.89.118.31.22 > 184.145.62.250.50756: Flags [P.], seq 1597216:1597380, ack 937, win 501, length 164
17:05:33.160786 IP 159.89.118.31.22 > 184.145.62.250.50756: Flags [P.], seq 1597380:1597648, ack 937, win 501, length 268
17:05:33.160959 IP 159.89.118.31.22 > 184.145.62.250.50756: Flags [P.], seq 1597648:1597812, ack 937, win 501, length 164
17:05:33.161139 IP 159.89.118.31.22 > 184.145.62.250.50756: Flags [P.], seq 1597812:1597976, ack 937, win 501, length 164
17:05:33.161329 IP 159.89.118.31.22 > 184.145.62.250.50756: Flags [P.], seq 1597976:1598140, ack 937, win 501, length 164
17:05:33.161520 IP 184.145.62.250.50756 > 159.89.118.31.22: Flags [P.], seq 937:973, ack 1595428, win 1023, length 36
17:05:33.161521 IP 184.145.62.250.50756 > 159.89.118.31.22: Flags [.], ack 1595860, win 1022, length 0
17:05:33.161521 IP 184.145.62.250.50756 > 159.89.118.31.22: Flags [.], ack 1596188, win 1026, length 0
17:05:33.161521 IP 184.145.62.250.50756 > 159.89.118.31.22: Flags [.], ack 1596620, win 1024, length 0
^C
11372 packets captured
11396 packets received by filter
22 packets dropped by kernel
