root@lamp-ubuntu-s-1vcpu-1gb-tor1-01:~# tcpdump -i eth0 port 22
17:07:33.062367 IP bras-base-toroon4512w-grc-52-184-145-62-250.dsl.bell.ca.50756 > 159.89.118.31.ssh: Flags [.], ack 1170024, win 1022, length 0
17:07:33.062396 IP 159.89.118.31.ssh > bras-base-toroon4512w-grc-52-184-145-62-250.dsl.bell.ca.50756: Flags [P.], seq 1171272:1171476, ack 721, win 501, length 204
17:07:33.062697 IP 159.89.118.31.ssh > bras-base-toroon4512w-grc-52-184-145-62-250.dsl.bell.ca.50756: Flags [P.], seq 1171476:1171824, ack 721, win 501, length 348
17:07:33.062868 IP bras-base-toroon4512w-grc-52-184-145-62-250.dsl.bell.ca.50756 > 159.89.118.31.ssh: Flags [.], ack 1170576, win 1026, length 0
17:07:33.063036 IP 159.89.118.31.ssh > bras-base-toroon4512w-grc-52-184-145-62-250.dsl.bell.ca.50756: Flags [P.], seq 1171824:1172172, ack 721, win 501, length 348
17:07:33.063296 IP 159.89.118.31.ssh > bras-base-toroon4512w-grc-52-184-145-62-250.dsl.bell.ca.50756: Flags [P.], seq 1172172:1172376, ack 721, win 501, length 204
17:07:33.063514 IP 159.89.118.31.ssh > bras-base-toroon4512w-grc-52-184-145-62-250.dsl.bell.ca.50756: Flags [P.], seq 1172376:1172580, ack 721, win 501, length 204
17:07:33.063725 IP 159.89.118.31.ssh > bras-base-toroon4512w-grc-52-184-145-62-250.dsl.bell.ca.50756: Flags [P.], seq 1172580:1172784, ack 721, win 501, length 204
17:07:33.063910 IP bras-base-toroon4512w-grc-52-184-145-62-250.dsl.bell.ca.50756 > 159.89.118.31.ssh: Flags [.], ack 1171272, win 1023, length 0
17:07:33.064082 IP 159.89.118.31.ssh > bras-base-toroon4512w-grc-52-184-145-62-250.dsl.bell.ca.50756: Flags [P.], seq 1172784:1173132, ack 721, win 501, length 348
17:07:33.064134 IP bras-base-toroon4512w-grc-52-184-145-62-250.dsl.bell.ca.50756 > 159.89.118.31.ssh: Flags [.], ack 1171824, win 1021, length 0
17:07:33.064362 IP 159.89.118.31.ssh > bras-base-toroon4512w-grc-52-184-145-62-250.dsl.bell.ca.50756: Flags [P.], seq 1173132:1173480, ack 721, win 501, length 348
17:07:33.064574 IP 159.89.118.31.ssh > bras-base-toroon4512w-grc-52-184-145-62-250.dsl.bell.ca.50756: Flags [P.], seq 1173480:1173684, ack 721, win 501, length 204
17:07:33.064775 IP 159.89.118.31.ssh > bras-base-toroon4512w-grc-52-184-145-62-250.dsl.bell.ca.50756: Flags [P.], seq 1173684:1173888, ack 721, win 501, length 204
17:07:33.064991 IP 159.89.118.31.ssh > bras-base-toroon4512w-grc-52-184-145-62-250.dsl.bell.ca.50756: Flags [P.], seq 1173888:1174092, ack 721, win 501, length 204
17:07:33.065242 IP bras-base-toroon4512w-grc-52-184-145-62-250.dsl.bell.ca.50756 > 159.89.118.31.ssh: Flags [.], ack 1172376, win 1026, length 0
17:07:33.065243 IP bras-base-toroon4512w-grc-52-184-145-62-250.dsl.bell.ca.50756 > 159.89.118.31.ssh: Flags [.], ack 1172784, win 1025, length 0
17:07:33.065437 IP 159.89.118.31.ssh > bras-base-toroon4512w-grc-52-184-145-62-250.dsl.bell.ca.50756: Flags [P.], seq 1174092:1174296, ack 721, win 501, length 204
17:07:33.065618 IP 159.89.118.31.ssh > bras-base-toroon4512w-grc-52-184-145-62-250.dsl.bell.ca.50756: Flags [P.], seq 1174296:1174628, ack 721, win 501, length 332
17:07:33.065697 IP 159.89.118.31.ssh > bras-base-toroon4512w-grc-52-184-145-62-250.dsl.bell.ca.50756: Flags [P.], seq 1174628:1174832, ack 721, win 501, length 204
17:07:33.065911 IP 159.89.118.31.ssh > bras-base-toroon4512w-grc-52-184-145-62-250.dsl.bell.ca.50756: Flags [P.], seq 1174832:1175196, ack 721, win 501, length 364
17:07:33.066110 IP 159.89.118.31.ssh > bras-base-toroon4512w-grc-52-184-145-62-250.dsl.bell.ca.50756: Flags [P.], seq 1175196:1175400, ack 721, win 501, length 204
17:07:33.066163 IP bras-base-toroon4512w-grc-52-184-145-62-250.dsl.bell.ca.50756 > 159.89.118.31.ssh: Flags [.], ack 1173480, win 1022, length 0
17:07:33.066242 IP bras-base-toroon4512w-grc-52-184-145-62-250.dsl.bell.ca.50756 > 159.89.118.31.ssh: Flags [.], ack 1173888, win 1026, length 0
17:07:33.066511 IP 159.89.118.31.ssh > bras-base-toroon4512w-grc-52-184-145-62-250.dsl.bell.ca.50756: Flags [P.], seq 1175400:1175892, ack 721, win 501, length 492
17:07:33.066710 IP 159.89.118.31.ssh > bras-base-toroon4512w-grc-52-184-145-62-250.dsl.bell.ca.50756: Flags [P.], seq 1175892:1176096, ack 721, win 501, length 204
17:07:33.066922 IP 159.89.118.31.ssh > bras-base-toroon4512w-grc-52-184-145-62-250.dsl.bell.ca.50756: Flags [P.], seq 1176096:1176300, ack 721, win 501, length 204
17:07:33.066998 IP bras-base-toroon4512w-grc-52-184-145-62-250.dsl.bell.ca.50756 > 159.89.118.31.ssh: Flags [.], ack 1174296, win 1025, length 0
17:07:33.067194 IP 159.89.118.31.ssh > bras-base-toroon4512w-grc-52-184-145-62-250.dsl.bell.ca.50756: Flags [P.], seq 1176300:1176648, ack 721, win 501, length 348
17:07:33.067459 IP bras-base-toroon4512w-grc-52-184-145-62-250.dsl.bell.ca.50756 > 159.89.118.31.ssh: Flags [.], ack 1174832, win 1022, length 0
17:07:33.067568 IP 159.89.118.31.ssh > bras-base-toroon4512w-grc-52-184-145-62-250.dsl.bell.ca.50756: Flags [P.], seq 1176648:1176852, ack 721, win 501, length 204
17:07:33.067623 IP bras-base-toroon4512w-grc-52-184-145-62-250.dsl.bell.ca.50756 > 159.89.118.31.ssh: Flags [.], ack 1175400, win 1026, length 0
17:07:33.067725 IP 159.89.118.31.ssh > bras-base-toroon4512w-grc-52-184-145-62-250.dsl.bell.ca.50756: Flags [P.], seq 1176852:1177032, ack 721, win 501, length 180
17:07:33.068008 IP 159.89.118.31.ssh > bras-base-toroon4512w-grc-52-184-145-62-250.dsl.bell.ca.50756: Flags [P.], seq 1177032:1177548, ack 721, win 501, length 516
17:07:33.068211 IP 159.89.118.31.ssh > bras-base-toroon4512w-grc-52-184-145-62-250.dsl.bell.ca.50756: Flags [P.], seq 1177548:1177752, ack 721, win 501, length 204
17:07:33.068323 IP bras-base-toroon4512w-grc-52-184-145-62-250.dsl.bell.ca.50756 > 159.89.118.31.ssh: Flags [.], ack 1176096, win 1023, length 0
17:07:33.068503 IP 159.89.118.31.ssh > bras-base-toroon4512w-grc-52-184-145-62-250.dsl.bell.ca.50756: Flags [P.], seq 1177752:1178100, ack 721, win 501, length 348
17:07:33.068709 IP 159.89.118.31.ssh > bras-base-toroon4512w-grc-52-184-145-62-250.dsl.bell.ca.50756: Flags [P.], seq 1178100:1178304, ack 721, win 501, length 204
17:07:33.068758 IP bras-base-toroon4512w-grc-52-184-145-62-250.dsl.bell.ca.50756 > 159.89.118.31.ssh: Flags [.], ack 1176648, win 1021, length 0
17:07:33.068997 IP 159.89.118.31.ssh > bras-base-toroon4512w-grc-52-184-145-62-250.dsl.bell.ca.50756: Flags [P.], seq 1178304:1178652, ack 721, win 501, length 348
17:07:33.069206 IP 159.89.118.31.ssh > bras-base-toroon4512w-grc-52-184-145-62-250.dsl.bell.ca.50756: Flags [P.], seq 1178652:1178856, ack 721, win 501, length 204
17:07:33.069372 IP bras-base-toroon4512w-grc-52-184-145-62-250.dsl.bell.ca.50756 > 159.89.118.31.ssh: Flags [.], ack 1177032, win 1026, length 0
17:07:33.069463 IP 159.89.118.31.ssh > bras-base-toroon4512w-grc-52-184-145-62-250.dsl.bell.ca.50756: Flags [P.], seq 1178856:1179060, ack 721, win 501, length 204
17:07:33.069695 IP 159.89.118.31.ssh > bras-base-toroon4512w-grc-52-184-145-62-250.dsl.bell.ca.50756: Flags [P.], seq 1179060:1179408, ack 721, win 501, length 348
17:07:33.069874 IP bras-base-toroon4512w-grc-52-184-145-62-250.dsl.bell.ca.50756 > 159.89.118.31.ssh: Flags [.], ack 1177752, win 1023, length 0
17:07:33.070036 IP 159.89.118.31.ssh > bras-base-toroon4512w-grc-52-184-145-62-250.dsl.bell.ca.50756: Flags [P.], seq 1179408:1179612, ack 721, win 501, length 204
17:07:33.070229 IP 159.89.118.31.ssh > bras-base-toroon4512w-grc-52-184-145-62-250.dsl.bell.ca.50756: Flags [P.], seq 1179612:1179792, ack 721, win 501, length 180
17:07:33.070401 IP bras-base-toroon4512w-grc-52-184-145-62-250.dsl.bell.ca.50756 > 159.89.118.31.ssh: Flags [.], ack 1178304, win 1021, length 0
17:07:33.070520 IP 159.89.118.31.ssh > bras-base-toroon4512w-grc-52-184-145-62-250.dsl.bell.ca.50756: Flags [P.], seq 1179792:1179996, ack 721, win 501, length 204
17:07:33.070605 IP 159.89.118.31.ssh > bras-base-toroon4512w-grc-52-184-145-62-250.dsl.bell.ca.50756: Flags [P.], seq 1179996:1180200, ack 721, win 501, length 204
17:07:33.070879 IP 159.89.118.31.ssh > bras-base-toroon4512w-grc-52-184-145-62-250.dsl.bell.ca.50756: Flags [P.], seq 1180200:1180716, ack 721, win 501, length 516
17:07:33.071094 IP 159.89.118.31.ssh > bras-base-toroon4512w-grc-52-184-145-62-250.dsl.bell.ca.50756: Flags [P.], seq 1180716:1180920, ack 721, win 501, length 204
17:07:33.071183 IP bras-base-toroon4512w-grc-52-184-145-62-250.dsl.bell.ca.50756 > 159.89.118.31.ssh: Flags [.], ack 1178856, win 1026, length 0
17:07:33.071291 IP bras-base-toroon4512w-grc-52-184-145-62-250.dsl.bell.ca.50756 > 159.89.118.31.ssh: Flags [.], ack 1179408, win 1024, length 0
17:07:33.071525 IP 159.89.118.31.ssh > bras-base-toroon4512w-grc-52-184-145-62-250.dsl.bell.ca.50756: Flags [P.], seq 1180920:1181412, ack 721, win 501, length 492
17:07:33.071761 IP 159.89.118.31.ssh > bras-base-toroon4512w-grc-52-184-145-62-250.dsl.bell.ca.50756: Flags [P.], seq 1181412:1181616, ack 721, win 501, length 204
17:07:33.071899 IP bras-base-toroon4512w-grc-52-184-145-62-250.dsl.bell.ca.50756 > 159.89.118.31.ssh: Flags [.], ack 1179792, win 1022, length 0
17:07:33.072078 IP 159.89.118.31.ssh > bras-base-toroon4512w-grc-52-184-145-62-250.dsl.bell.ca.50756: Flags [P.], seq 1181616:1181964, ack 721, win 501, length 348
17:07:33.072118 IP bras-base-toroon4512w-grc-52-184-145-62-250.dsl.bell.ca.50756 > 159.89.118.31.ssh: Flags [.], ack 1180200, win 1021, length 0
17:07:33.072352 IP 159.89.118.31.ssh > bras-base-toroon4512w-grc-52-184-145-62-250.dsl.bell.ca.50756: Flags [P.], seq 1181964:1182312, ack 721, win 501, length 348
17:07:33.072558 IP 159.89.118.31.ssh > bras-base-toroon4512w-grc-52-184-145-62-250.dsl.bell.ca.50756: Flags [P.], seq 1182312:1182516, ack 721, win 501, length 204
17:07:33.072743 IP bras-base-toroon4512w-grc-52-184-145-62-250.dsl.bell.ca.50756 > 159.89.118.31.ssh: Flags [.], ack 1180920, win 1026, length 0
17:07:33.072827 IP 159.89.118.31.ssh > bras-base-toroon4512w-grc-52-184-145-62-250.dsl.bell.ca.50756: Flags [P.], seq 1182516:1182720, ack 721, win 501, length 204
17:07:33.073074 IP 159.89.118.31.ssh > bras-base-toroon4512w-grc-52-184-145-62-250.dsl.bell.ca.50756: Flags [P.], seq 1182720:1183068, ack 721, win 501, length 348
17:07:33.073243 IP bras-base-toroon4512w-grc-52-184-145-62-250.dsl.bell.ca.50756 > 159.89.118.31.ssh: Flags [.], ack 1181616, win 1023, length 0
17:07:33.073243 IP bras-base-toroon4512w-grc-52-184-145-62-250.dsl.bell.ca.50756 > 159.89.118.31.ssh: Flags [P.], seq 721:757, ack 1181616, win 1023, length 36
17:07:33.073478 IP 159.89.118.31.ssh > bras-base-toroon4512w-grc-52-184-145-62-250.dsl.bell.ca.50756: Flags [P.], seq 1183068:1183576, ack 757, win 501, length 508
17:07:33.073692 IP 159.89.118.31.ssh > bras-base-toroon4512w-grc-52-184-145-62-250.dsl.bell.ca.50756: Flags [P.], seq 1183576:1183780, ack 757, win 501, length 204
17:07:33.073895 IP 159.89.118.31.ssh > bras-base-toroon4512w-grc-52-184-145-62-250.dsl.bell.ca.50756: Flags [P.], seq 1183780:1183984, ack 757, win 501, length 204
17:07:33.074066 IP bras-base-toroon4512w-grc-52-184-145-62-250.dsl.bell.ca.50756 > 159.89.118.31.ssh: Flags [.], ack 1182312, win 1021, length 0
17:07:33.074066 IP bras-base-toroon4512w-grc-52-184-145-62-250.dsl.bell.ca.50756 > 159.89.118.31.ssh: Flags [.], ack 1182516, win 1026, length 0
17:07:33.074263 IP 159.89.118.31.ssh > bras-base-toroon4512w-grc-52-184-145-62-250.dsl.bell.ca.50756: Flags [P.], seq 1183984:1184476, ack 757, win 501, length 492
17:07:33.074736 IP bras-base-toroon4512w-grc-52-184-145-62-250.dsl.bell.ca.50756 > 159.89.118.31.ssh: Flags [.], ack 1182720, win 1025, length 0
17:07:33.074969 IP 159.89.118.31.ssh > bras-base-toroon4512w-grc-52-184-145-62-250.dsl.bell.ca.50756: Flags [P.], seq 1184476:1184824, ack 757, win 501, length 348
17:07:33.075019 IP bras-base-toroon4512w-grc-52-184-145-62-250.dsl.bell.ca.50756 > 159.89.118.31.ssh: Flags [.], ack 1183576, win 1022, length 0
17:07:33.075272 IP 159.89.118.31.ssh > bras-base-toroon4512w-grc-52-184-145-62-250.dsl.bell.ca.50756: Flags [P.], seq 1184824:1185172, ack 757, win 501, length 348
17:07:33.075374 IP bras-base-toroon4512w-grc-52-184-145-62-250.dsl.bell.ca.50756 > 159.89.118.31.ssh: Flags [.], ack 1183984, win 1026, length 0
17:07:33.075560 IP 159.89.118.31.ssh > bras-base-toroon4512w-grc-52-184-145-62-250.dsl.bell.ca.50756: Flags [P.], seq 1185172:1185520, ack 757, win 501, length 348
17:07:33.075749 IP 159.89.118.31.ssh > bras-base-toroon4512w-grc-52-184-145-62-250.dsl.bell.ca.50756: Flags [P.], seq 1185520:1185724, ack 757, win 501, length 204
17:07:33.075940 IP 159.89.118.31.ssh > bras-base-toroon4512w-grc-52-184-145-62-250.dsl.bell.ca.50756: Flags [P.], seq 1185724:1185928, ack 757, win 501, length 204
17:07:33.076126 IP 159.89.118.31.ssh > bras-base-toroon4512w-grc-52-184-145-62-250.dsl.bell.ca.50756: Flags [P.], seq 1185928:1186132, ack 757, win 501, length 204
17:07:33.076314 IP 159.89.118.31.ssh > bras-base-toroon4512w-grc-52-184-145-62-250.dsl.bell.ca.50756: Flags [P.], seq 1186132:1186336, ack 757, win 501, length 204
17:07:33.076500 IP bras-base-toroon4512w-grc-52-184-145-62-250.dsl.bell.ca.50756 > 159.89.118.31.ssh: Flags [.], ack 1184824, win 1023, length 0
17:07:33.076643 IP 159.89.118.31.ssh > bras-base-toroon4512w-grc-52-184-145-62-250.dsl.bell.ca.50756: Flags [P.], seq 1186336:1186540, ack 757, win 501, length 204
17:07:33.076825 IP 159.89.118.31.ssh > bras-base-toroon4512w-grc-52-184-145-62-250.dsl.bell.ca.50756: Flags [P.], seq 1186540:1186720, ack 757, win 501, length 180
17:07:33.077011 IP 159.89.118.31.ssh > bras-base-toroon4512w-grc-52-184-145-62-250.dsl.bell.ca.50756: Flags [P.], seq 1186720:1186924, ack 757, win 501, length 204
17:07:33.077109 IP bras-base-toroon4512w-grc-52-184-145-62-250.dsl.bell.ca.50756 > 159.89.118.31.ssh: Flags [.], ack 1185520, win 1026, length 0
17:07:33.077268 IP 159.89.118.31.ssh > bras-base-toroon4512w-grc-52-184-145-62-250.dsl.bell.ca.50756: Flags [P.], seq 1186924:1187128, ack 757, win 501, length 204
17:07:33.077450 IP 159.89.118.31.ssh > bras-base-toroon4512w-grc-52-184-145-62-250.dsl.bell.ca.50756: Flags [P.], seq 1187128:1187476, ack 757, win 501, length 348
17:07:33.077537 IP 159.89.118.31.ssh > bras-base-toroon4512w-grc-52-184-145-62-250.dsl.bell.ca.50756: Flags [P.], seq 1187476:1187680, ack 757, win 501, length 204
17:07:33.077614 IP bras-base-toroon4512w-grc-52-184-145-62-250.dsl.bell.ca.50756 > 159.89.118.31.ssh: Flags [.], ack 1185928, win 1025, length 0
17:07:33.077740 IP bras-base-toroon4512w-grc-52-184-145-62-250.dsl.bell.ca.50756 > 159.89.118.31.ssh: Flags [.], ack 1186336, win 1023, length 0
17:07:33.077888 IP 159.89.118.31.ssh > bras-base-toroon4512w-grc-52-184-145-62-250.dsl.bell.ca.50756: Flags [P.], seq 1187680:1188340, ack 757, win 501, length 660
17:07:33.078065 IP 159.89.118.31.ssh > bras-base-toroon4512w-grc-52-184-145-62-250.dsl.bell.ca.50756: Flags [P.], seq 1188340:1188544, ack 757, win 501, length 204
17:07:33.078255 IP 159.89.118.31.ssh > bras-base-toroon4512w-grc-52-184-145-62-250.dsl.bell.ca.50756: Flags [P.], seq 1188544:1188748, ack 757, win 501, length 204
17:07:33.078364 IP bras-base-toroon4512w-grc-52-184-145-62-250.dsl.bell.ca.50756 > 159.89.118.31.ssh: Flags [.], ack 1186720, win 1021, length 0
17:07:33.078608 IP 159.89.118.31.ssh > bras-base-toroon4512w-grc-52-184-145-62-250.dsl.bell.ca.50756: Flags [P.], seq 1188748:1189096, ack 757, win 501, length 348
17:07:33.078820 IP 159.89.118.31.ssh > bras-base-toroon4512w-grc-52-184-145-62-250.dsl.bell.ca.50756: Flags [P.], seq 1189096:1189300, ack 757, win 501, length 204
17:07:33.078878 IP bras-base-toroon4512w-grc-52-184-145-62-250.dsl.bell.ca.50756 > 159.89.118.31.ssh: Flags [.], ack 1187128, win 1026, length 0
17:07:33.078991 IP bras-base-toroon4512w-grc-52-184-145-62-250.dsl.bell.ca.50756 > 159.89.118.31.ssh: Flags [.], ack 1187680, win 1024, length 0
17:07:33.079193 IP 159.89.118.31.ssh > bras-base-toroon4512w-grc-52-184-145-62-250.dsl.bell.ca.50756: Flags [P.], seq 1189300:1189792, ack 757, win 501, length 492
17:07:33.079456 IP 159.89.118.31.ssh > bras-base-toroon4512w-grc-52-184-145-62-250.dsl.bell.ca.50756: Flags [P.], seq 1189792:1189996, ack 757, win 501, length 204
17:07:33.079666 IP 159.89.118.31.ssh > bras-base-toroon4512w-grc-52-184-145-62-250.dsl.bell.ca.50756: Flags [P.], seq 1189996:1190200, ack 757, win 501, length 204
17:07:33.079757 IP bras-base-toroon4512w-grc-52-184-145-62-250.dsl.bell.ca.50756 > 159.89.118.31.ssh: Flags [.], ack 1188544, win 1021, length 0
17:07:33.079956 IP 159.89.118.31.ssh > bras-base-toroon4512w-grc-52-184-145-62-250.dsl.bell.ca.50756: Flags [P.], seq 1190200:1190548, ack 757, win 501, length 348
17:07:33.080133 IP bras-base-toroon4512w-grc-52-184-145-62-250.dsl.bell.ca.50756 > 159.89.118.31.ssh: Flags [.], ack 1189096, win 1026, length 0
17:07:33.080575 IP 159.89.118.31.ssh > bras-base-toroon4512w-grc-52-184-145-62-250.dsl.bell.ca.50756: Flags [P.], seq 1190548:1190896, ack 757, win 501, length 348
17:07:33.080768 IP bras-base-toroon4512w-grc-52-184-145-62-250.dsl.bell.ca.50756 > 159.89.118.31.ssh: Flags [.], ack 1189792, win 1023, length 0
17:07:33.080854 IP 159.89.118.31.ssh > bras-base-toroon4512w-grc-52-184-145-62-250.dsl.bell.ca.50756: Flags [P.], seq 1190896:1191100, ack 757, win 501, length 204
17:07:33.081073 IP 159.89.118.31.ssh > bras-base-toroon4512w-grc-52-184-145-62-250.dsl.bell.ca.50756: Flags [P.], seq 1191100:1191448, ack 757, win 501, length 348
17:07:33.081200 IP bras-base-toroon4512w-grc-52-184-145-62-250.dsl.bell.ca.50756 > 159.89.118.31.ssh: Flags [.], ack 1190200, win 1022, length 0
17:07:33.081389 IP 159.89.118.31.ssh > bras-base-toroon4512w-grc-52-184-145-62-250.dsl.bell.ca.50756: Flags [P.], seq 1191448:1191796, ack 757, win 501, length 348
17:07:33.081609 IP 159.89.118.31.ssh > bras-base-toroon4512w-grc-52-184-145-62-250.dsl.bell.ca.50756: Flags [P.], seq 1191796:1192000, ack 757, win 501, length 204
17:07:33.081818 IP 159.89.118.31.ssh > bras-base-toroon4512w-grc-52-184-145-62-250.dsl.bell.ca.50756: Flags [P.], seq 1192000:1192204, ack 757, win 501, length 204
17:07:33.082004 IP 159.89.118.31.ssh > bras-base-toroon4512w-grc-52-184-145-62-250.dsl.bell.ca.50756: Flags [P.], seq 1192204:1192408, ack 757, win 501, length 204
17:07:33.082136 IP bras-base-toroon4512w-grc-52-184-145-62-250.dsl.bell.ca.50756 > 159.89.118.31.ssh: Flags [.], ack 1190896, win 1026, length 0
17:07:33.082313 IP 159.89.118.31.ssh > bras-base-toroon4512w-grc-52-184-145-62-250.dsl.bell.ca.50756: Flags [P.], seq 1192408:1192756, ack 757, win 501, length 348
17:07:33.082511 IP bras-base-toroon4512w-grc-52-184-145-62-250.dsl.bell.ca.50756 > 159.89.118.31.ssh: Flags [.], ack 1191448, win 1024, length 0
17:07:33.082606 IP 159.89.118.31.ssh > bras-base-toroon4512w-grc-52-184-145-62-250.dsl.bell.ca.50756: Flags [P.], seq 1192756:1192960, ack 757, win 501, length 204
17:07:33.082831 IP 159.89.118.31.ssh > bras-base-toroon4512w-grc-52-184-145-62-250.dsl.bell.ca.50756: Flags [P.], seq 1192960:1193308, ack 757, win 501, length 348
17:07:33.083042 IP 159.89.118.31.ssh > bras-base-toroon4512w-grc-52-184-145-62-250.dsl.bell.ca.50756: Flags [P.], seq 1193308:1193512, ack 757, win 501, length 204
17:07:33.083133 IP bras-base-toroon4512w-grc-52-184-145-62-250.dsl.bell.ca.50756 > 159.89.118.31.ssh: Flags [.], ack 1192000, win 1022, length 0
17:07:33.083387 IP 159.89.118.31.ssh > bras-base-toroon4512w-grc-52-184-145-62-250.dsl.bell.ca.50756: Flags [P.], seq 1193512:1193860, ack 757, win 501, length 348
17:07:33.083625 IP bras-base-toroon4512w-grc-52-184-145-62-250.dsl.bell.ca.50756 > 159.89.118.31.ssh: Flags [.], ack 1192408, win 1026, length 0
17:07:33.083664 IP 159.89.118.31.ssh > bras-base-toroon4512w-grc-52-184-145-62-250.dsl.bell.ca.50756: Flags [P.], seq 1193860:1194064, ack 757, win 501, length 204
17:07:33.083902 IP 159.89.118.31.ssh > bras-base-toroon4512w-grc-52-184-145-62-250.dsl.bell.ca.50756: Flags [P.], seq 1194064:1194412, ack 757, win 501, length 348
17:07:33.084112 IP 159.89.118.31.ssh > bras-base-toroon4512w-grc-52-184-145-62-250.dsl.bell.ca.50756: Flags [P.], seq 1194412:1194616, ack 757, win 501, length 204
17:07:33.084175 IP bras-base-toroon4512w-grc-52-184-145-62-250.dsl.bell.ca.50756 > 159.89.118.31.ssh: Flags [.], ack 1192960, win 1024, length 0
17:07:33.084409 IP 159.89.118.31.ssh > bras-base-toroon4512w-grc-52-184-145-62-250.dsl.bell.ca.50756: Flags [P.], seq 1194616:1194964, ack 757, win 501, length 348
17:07:33.084613 IP bras-base-toroon4512w-grc-52-184-145-62-250.dsl.bell.ca.50756 > 159.89.118.31.ssh: Flags [.], ack 1193512, win 1022, length 0
17:07:33.084718 IP 159.89.118.31.ssh > bras-base-toroon4512w-grc-52-184-145-62-250.dsl.bell.ca.50756: Flags [P.], seq 1194964:1195168, ack 757, win 501, length 204
17:07:33.084924 IP 159.89.118.31.ssh > bras-base-toroon4512w-grc-52-184-145-62-250.dsl.bell.ca.50756: Flags [P.], seq 1195168:1195516, ack 757, win 501, length 348
17:07:33.085122 IP bras-base-toroon4512w-grc-52-184-145-62-250.dsl.bell.ca.50756 > 159.89.118.31.ssh: Flags [.], ack 1194064, win 1026, length 0
17:07:33.085266 IP 159.89.118.31.ssh > bras-base-toroon4512w-grc-52-184-145-62-250.dsl.bell.ca.50756: Flags [P.], seq 1195516:1195720, ack 757, win 501, length 204
17:07:33.085428 IP 159.89.118.31.ssh > bras-base-toroon4512w-grc-52-184-145-62-250.dsl.bell.ca.50756: Flags [P.], seq 1195720:1195900, ack 757, win 501, length 180
17:07:33.085504 IP 159.89.118.31.ssh > bras-base-toroon4512w-grc-52-184-145-62-250.dsl.bell.ca.50756: Flags [P.], seq 1195900:1196104, ack 757, win 501, length 204
17:07:33.085617 IP bras-base-toroon4512w-grc-52-184-145-62-250.dsl.bell.ca.50756 > 159.89.118.31.ssh: Flags [.], ack 1194616, win 1024, length 0
17:07:33.085780 IP 159.89.118.31.ssh > bras-base-toroon4512w-grc-52-184-145-62-250.dsl.bell.ca.50756: Flags [P.], seq 1196104:1196620, ack 757, win 501, length 516
17:07:33.085951 IP 159.89.118.31.ssh > bras-base-toroon4512w-grc-52-184-145-62-250.dsl.bell.ca.50756: Flags [P.], seq 1196620:1196824, ack 757, win 501, length 204
17:07:33.086145 IP 159.89.118.31.ssh > bras-base-toroon4512w-grc-52-184-145-62-250.dsl.bell.ca.50756: Flags [P.], seq 1196824:1197028, ack 757, win 501, length 204
17:07:33.086245 IP bras-base-toroon4512w-grc-52-184-145-62-250.dsl.bell.ca.50756 > 159.89.118.31.ssh: Flags [.], ack 1195168, win 1022, length 0
17:07:33.086473 IP 159.89.118.31.ssh > bras-base-toroon4512w-grc-52-184-145-62-250.dsl.bell.ca.50756: Flags [P.], seq 1197028:1197376, ack 757, win 501, length 348
17:07:33.086693 IP 159.89.118.31.ssh > bras-base-toroon4512w-grc-52-184-145-62-250.dsl.bell.ca.50756: Flags [P.], seq 1197376:1197580, ack 757, win 501, length 204
17:07:33.086765 IP bras-base-toroon4512w-grc-52-184-145-62-250.dsl.bell.ca.50756 > 159.89.118.31.ssh: Flags [.], ack 1195720, win 1026, length 0
17:07:33.086995 IP bras-base-toroon4512w-grc-52-184-145-62-250.dsl.bell.ca.50756 > 159.89.118.31.ssh: Flags [.], ack 1196104, win 1025, length 0
17:07:33.087121 IP 159.89.118.31.ssh > bras-base-toroon4512w-grc-52-184-145-62-250.dsl.bell.ca.50756: Flags [P.], seq 1197580:1197928, ack 757, win 501, length 348
17:07:33.087349 IP 159.89.118.31.ssh > bras-base-toroon4512w-grc-52-184-145-62-250.dsl.bell.ca.50756: Flags [P.], seq 1197928:1198276, ack 757, win 501, length 348
17:07:33.087395 IP bras-base-toroon4512w-grc-52-184-145-62-250.dsl.bell.ca.50756 > 159.89.118.31.ssh: Flags [.], ack 1196824, win 1022, length 0
17:07:33.087636 IP 159.89.118.31.ssh > bras-base-toroon4512w-grc-52-184-145-62-250.dsl.bell.ca.50756: Flags [P.], seq 1198276:1198624, ack 757, win 501, length 348
17:07:33.087849 IP 159.89.118.31.ssh > bras-base-toroon4512w-grc-52-184-145-62-250.dsl.bell.ca.50756: Flags [P.], seq 1198624:1198828, ack 757, win 501, length 204
17:07:33.088070 IP 159.89.118.31.ssh > bras-base-toroon4512w-grc-52-184-145-62-250.dsl.bell.ca.50756: Flags [P.], seq 1198828:1199032, ack 757, win 501, length 204
17:07:33.088123 IP bras-base-toroon4512w-grc-52-184-145-62-250.dsl.bell.ca.50756 > 159.89.118.31.ssh: Flags [.], ack 1197376, win 1026, length 0
17:07:33.088323 IP 159.89.118.31.ssh > bras-base-toroon4512w-grc-52-184-145-62-250.dsl.bell.ca.50756: Flags [P.], seq 1199032:1199380, ack 757, win 501, length 348
17:07:33.088536 IP 159.89.118.31.ssh > bras-base-toroon4512w-grc-52-184-145-62-250.dsl.bell.ca.50756: Flags [P.], seq 1199380:1199584, ack 757, win 501, length 204
17:07:33.088650 IP bras-base-toroon4512w-grc-52-184-145-62-250.dsl.bell.ca.50756 > 159.89.118.31.ssh: Flags [.], ack 1197928, win 1024, length 0
17:07:33.088828 IP 159.89.118.31.ssh > bras-base-toroon4512w-grc-52-184-145-62-250.dsl.bell.ca.50756: Flags [P.], seq 1199584:1199932, ack 757, win 501, length 348
17:07:33.089041 IP 159.89.118.31.ssh > bras-base-toroon4512w-grc-52-184-145-62-250.dsl.bell.ca.50756: Flags [P.], seq 1199932:1200136, ack 757, win 501, length 204
17:07:33.089136 IP bras-base-toroon4512w-grc-52-184-145-62-250.dsl.bell.ca.50756 > 159.89.118.31.ssh: Flags [.], ack 1198624, win 1021, length 0
17:07:33.089337 IP 159.89.118.31.ssh > bras-base-toroon4512w-grc-52-184-145-62-250.dsl.bell.ca.50756: Flags [P.], seq 1200136:1200484, ack 757, win 501, length 348
17:07:33.089534 IP 159.89.118.31.ssh > bras-base-toroon4512w-grc-52-184-145-62-250.dsl.bell.ca.50756: Flags [P.], seq 1200484:1200688, ack 757, win 501, length 204
17:07:33.089632 IP bras-base-toroon4512w-grc-52-184-145-62-250.dsl.bell.ca.50756 > 159.89.118.31.ssh: Flags [.], ack 1199032, win 1026, length 0
17:07:33.089825 IP 159.89.118.31.ssh > bras-base-toroon4512w-grc-52-184-145-62-250.dsl.bell.ca.50756: Flags [P.], seq 1200688:1201036, ack 757, win 501, length 348
17:07:33.090022 IP 159.89.118.31.ssh > bras-base-toroon4512w-grc-52-184-145-62-250.dsl.bell.ca.50756: Flags [P.], seq 1201036:1201240, ack 757, win 501, length 204
17:07:33.090137 IP bras-base-toroon4512w-grc-52-184-145-62-250.dsl.bell.ca.50756 > 159.89.118.31.ssh: Flags [.], ack 1199584, win 1024, length 0
17:07:33.090314 IP 159.89.118.31.ssh > bras-base-toroon4512w-grc-52-184-145-62-250.dsl.bell.ca.50756: Flags [P.], seq 1201240:1201588, ack 757, win 501, length 348
17:07:33.090570 IP 159.89.118.31.ssh > bras-base-toroon4512w-grc-52-184-145-62-250.dsl.bell.ca.50756: Flags [P.], seq 1201588:1201792, ack 757, win 501, length 204
17:07:33.090653 IP bras-base-toroon4512w-grc-52-184-145-62-250.dsl.bell.ca.50756 > 159.89.118.31.ssh: Flags [.], ack 1200136, win 1022, length 0
17:07:33.090858 IP 159.89.118.31.ssh > bras-base-toroon4512w-grc-52-184-145-62-250.dsl.bell.ca.50756: Flags [P.], seq 1201792:1202140, ack 757, win 501, length 348
17:07:33.091077 IP 159.89.118.31.ssh > bras-base-toroon4512w-grc-52-184-145-62-250.dsl.bell.ca.50756: Flags [P.], seq 1202140:1202344, ack 757, win 501, length 204
17:07:33.091129 IP bras-base-toroon4512w-grc-52-184-145-62-250.dsl.bell.ca.50756 > 159.89.118.31.ssh: Flags [.], ack 1200688, win 1026, length 0
17:07:33.091402 IP 159.89.118.31.ssh > bras-base-toroon4512w-grc-52-184-145-62-250.dsl.bell.ca.50756: Flags [P.], seq 1202344:1202692, ack 757, win 501, length 348
17:07:33.091583 IP 159.89.118.31.ssh > bras-base-toroon4512w-grc-52-184-145-62-250.dsl.bell.ca.50756: Flags [P.], seq 1202692:1202896, ack 757, win 501, length 204
17:07:33.091627 IP bras-base-toroon4512w-grc-52-184-145-62-250.dsl.bell.ca.50756 > 159.89.118.31.ssh: Flags [.], ack 1201240, win 1024, length 0
17:07:33.091848 IP 159.89.118.31.ssh > bras-base-toroon4512w-grc-52-184-145-62-250.dsl.bell.ca.50756: Flags [P.], seq 1202896:1203244, ack 757, win 501, length 348
17:07:33.092051 IP 159.89.118.31.ssh > bras-base-toroon4512w-grc-52-184-145-62-250.dsl.bell.ca.50756: Flags [P.], seq 1203244:1203448, ack 757, win 501, length 204
17:07:33.092139 IP bras-base-toroon4512w-grc-52-184-145-62-250.dsl.bell.ca.50756 > 159.89.118.31.ssh: Flags [.], ack 1201792, win 1022, length 0
17:07:33.092336 IP 159.89.118.31.ssh > bras-base-toroon4512w-grc-52-184-145-62-250.dsl.bell.ca.50756: Flags [P.], seq 1203448:1203796, ack 757, win 501, length 348
17:07:33.092535 IP 159.89.118.31.ssh > bras-base-toroon4512w-grc-52-184-145-62-250.dsl.bell.ca.50756: Flags [P.], seq 1203796:1204000, ack 757, win 501, length 204
17:07:33.092614 IP bras-base-toroon4512w-grc-52-184-145-62-250.dsl.bell.ca.50756 > 159.89.118.31.ssh: Flags [.], ack 1202344, win 1026, length 0
17:07:33.092810 IP 159.89.118.31.ssh > bras-base-toroon4512w-grc-52-184-145-62-250.dsl.bell.ca.50756: Flags [P.], seq 1204000:1204348, ack 757, win 501, length 348
17:07:33.093007 IP 159.89.118.31.ssh > bras-base-toroon4512w-grc-52-184-145-62-250.dsl.bell.ca.50756: Flags [P.], seq 1204348:1204552, ack 757, win 501, length 204
17:07:33.093133 IP bras-base-toroon4512w-grc-52-184-145-62-250.dsl.bell.ca.50756 > 159.89.118.31.ssh: Flags [.], ack 1202896, win 1024, length 0
17:07:33.093307 IP 159.89.118.31.ssh > bras-base-toroon4512w-grc-52-184-145-62-250.dsl.bell.ca.50756: Flags [P.], seq 1204552:1204900, ack 757, win 501, length 348
17:07:33.093513 IP 159.89.118.31.ssh > bras-base-toroon4512w-grc-52-184-145-62-250.dsl.bell.ca.50756: Flags [P.], seq 1204900:1205104, ack 757, win 501, length 204
17:07:33.093606 IP bras-base-toroon4512w-grc-52-184-145-62-250.dsl.bell.ca.50756 > 159.89.118.31.ssh: Flags [.], ack 1203448, win 1022, length 0
17:07:33.093808 IP 159.89.118.31.ssh > bras-base-toroon4512w-grc-52-184-145-62-250.dsl.bell.ca.50756: Flags [P.], seq 1205104:1205452, ack 757, win 501, length 348
17:07:33.094027 IP 159.89.118.31.ssh > bras-base-toroon4512w-grc-52-184-145-62-250.dsl.bell.ca.50756: Flags [P.], seq 1205452:1205656, ack 757, win 501, length 204
17:07:33.094125 IP bras-base-toroon4512w-grc-52-184-145-62-250.dsl.bell.ca.50756 > 159.89.118.31.ssh: Flags [.], ack 1204000, win 1026, length 0
17:07:33.094330 IP 159.89.118.31.ssh > bras-base-toroon4512w-grc-52-184-145-62-250.dsl.bell.ca.50756: Flags [P.], seq 1205656:1206004, ack 757, win 501, length 348
17:07:33.094610 IP bras-base-toroon4512w-grc-52-184-145-62-250.dsl.bell.ca.50756 > 159.89.118.31.ssh: Flags [.], ack 1204552, win 1024, length 0
17:07:33.094722 IP 159.89.118.31.ssh > bras-base-toroon4512w-grc-52-184-145-62-250.dsl.bell.ca.50756: Flags [P.], seq 1206004:1206208, ack 757, win 501, length 204
17:07:33.094847 IP 159.89.118.31.ssh > bras-base-toroon4512w-grc-52-184-145-62-250.dsl.bell.ca.50756: Flags [P.], seq 1206208:1206388, ack 757, win 501, length 180
17:07:33.094998 IP bras-base-toroon4512w-grc-52-184-145-62-250.dsl.bell.ca.50756 > 159.89.118.31.ssh: Flags [P.], seq 757:793, ack 1204900, win 1023, length 36
^C
6585 packets captured
6590 packets received by filter
4 packets dropped by kernel
