root@lamp-ubuntu-s-1vcpu-1gb-tor1-01:~# tcpdump -c 5 -i eth0
tcpdump: verbose output suppressed, use -v or -vv for full protocol decode
listening on eth0, link-type EN10MB (Ethernet), capture size 262144 bytes
16:55:51.895053 IP 159.89.118.31.ssh > bras-base-toroon4512w-grc-52-184-145-62-250.dsl.bell.ca.50756: Flags [P.], seq 2580531495:2580531603, ack 2888637669, win 501, length 108
16:55:51.895201 IP 159.89.118.31.ssh > bras-base-toroon4512w-grc-52-184-145-62-250.dsl.bell.ca.50756: Flags [P.], seq 108:144, ack 1, win 501, length 36
16:55:51.895409 IP 159.89.118.31.ssh > bras-base-toroon4512w-grc-52-184-145-62-250.dsl.bell.ca.50756: Flags [P.], seq 144:252, ack 1, win 501, length 108
16:55:51.895519 IP 159.89.118.31.ssh > bras-base-toroon4512w-grc-52-184-145-62-250.dsl.bell.ca.50756: Flags [P.], seq 252:288, ack 1, win 501, length 36
16:55:51.896241 IP 159.89.118.31.46770 > dns.google.domain: 45507+ PTR? 250.62.145.184.in-addr.arpa. (45)
5 packets captured
23 packets received by filter
0 packets dropped by kernel
